{
  "$schema": "http://json-schema.org/draft-07/schema#",
  "$id": "https://futuresofsoftwarework.github.io/schemas/signal-draft.schema.json",
  "title": "AI signal draft",
  "description": "A signal draft awaiting review in data/signal-drafts/. Generated from scripts/lib/signal-schema.mjs and scripts/lib/review-schema.mjs by scripts/build-draft-schema.mjs — do not hand-edit.",
  "type": "object",
  "required": [
    "id",
    "title",
    "summary",
    "source",
    "detectedAt",
    "date",
    "status"
  ],
  "properties": {
    "$schema": {
      "type": "string",
      "description": "Editor affordance. Stripped by signals:promote; never published."
    },
    "id": {
      "type": "string",
      "pattern": "^\\d{4}-\\d{2}-\\d{2}-\\d+$",
      "description": "YYYY-MM-DD-NN. Must match the filename."
    },
    "title": {
      "type": "string"
    },
    "summary": {
      "type": "string",
      "description": "3-7 sentences: what changed and why it matters for software work."
    },
    "source": {
      "type": "string"
    },
    "sourceUrl": {
      "type": "string",
      "format": "uri",
      "description": "Absolute http(s) URL. Reserved placeholder domains (example.com, localhost, .test, .invalid) are rejected."
    },
    "sourceType": {
      "type": "string",
      "enum": [
        "academic",
        "article",
        "social",
        "video",
        "discussion",
        "release"
      ]
    },
    "signalType": {
      "type": "string",
      "enum": [
        "practitioner-account",
        "field-report",
        "study",
        "tool-shift",
        "regulation-standard",
        "market-event",
        "forecast",
        "primary-research"
      ]
    },
    "signalStrength": {
      "type": "string",
      "enum": [
        "weak",
        "emerging",
        "established"
      ]
    },
    "signalStage": {
      "type": "string",
      "enum": [
        "leading",
        "concurrent",
        "lagging"
      ]
    },
    "availability": {
      "type": "string",
      "enum": [
        "GA",
        "preview",
        "announced"
      ]
    },
    "category": {
      "type": "array",
      "items": {
        "type": "string",
        "enum": [
          "AI Agents",
          "AI Tools",
          "Productivity",
          "SDLC Change",
          "Quality & Testing",
          "Security & Risk",
          "Org & Leadership",
          "Skills & Learning",
          "Work Wellbeing",
          "Ethics & Policy",
          "Business Impact",
          "Costs & Economics",
          "Other"
        ]
      },
      "maxItems": 3
    },
    "status": {
      "type": "string",
      "enum": [
        "published",
        "draft"
      ]
    },
    "detectedAt": {
      "type": "string"
    },
    "date": {
      "type": "string"
    },
    "tags": {
      "type": "array",
      "items": {
        "type": "string"
      }
    },
    "whyItMatters": {
      "type": "array",
      "items": {
        "type": "string"
      }
    },
    "recommendedActions": {
      "type": "array",
      "items": {
        "type": "string"
      }
    },
    "risksAndCaveats": {
      "type": "array",
      "items": {
        "type": "string"
      }
    },
    "corroboration": {
      "type": "array",
      "items": {
        "type": "string"
      }
    },
    "_review": {
      "type": "object",
      "description": "The REVIEWER writes this, never the finder. Rationale only — the folder you move the file into is the decision. Stripped by signals:promote and never published.",
      "additionalProperties": false,
      "properties": {
        "under": {
          "type": "string",
          "description": "The rule that disqualified it. Hover a value for what it means.",
          "enum": [
            "out-of-sector",
            "wrong-construct",
            "outside-window",
            "too-vague",
            "stale-fieldwork",
            "no-original-data",
            "overlaps-published",
            "unverifiable-source",
            "not-primary-source",
            "commercial-intent",
            "already-in-ledger",
            "seo-content-no-method",
            "adjacent-already-covered",
            "illustrative-not-measured",
            "superseded-by-later-development",
            "aggregator-used-primary-instead",
            "capped-this-run",
            "low-altitude",
            "unrecorded"
          ],
          "enumDescriptions": [
            "Real signal, but not about this sector's subject.",
            "Did not measure the thing the claim is about, however well reported.",
            "Outside the run's search window.",
            "States a principle or direction without the specifics the claim needs.",
            "Data collected before the mechanism it is cited for existed.",
            "Repeats figures it did not gather.",
            "The same development is already live on the site.",
            "The claim cannot be traced to a nameable source.",
            "A recap of something else; the primary exists.",
            "Content whose purpose is to sell the capability it describes.",
            "Already evaluated in a previous run.",
            "Search-optimised content whose numbers have no stated method.",
            "The site already covers this from another angle.",
            "Figures are modelled or illustrative rather than observed.",
            "Overtaken by events since publication.",
            "Found via an aggregator; the primary source was used.",
            "Deferred by a per-run quota — NOT disqualified; a candidate for a later run.",
            "The durable takeaway is a command, flag, config or library choice rather than a change in how work is organised.",
            "Written by code when a decision was made without a rationale. Do not choose this by hand."
          ]
        },
        "note": {
          "type": "string",
          "description": "Why, specifically. Name the disqualifying fact: \"the consequence is the exploit, not a policy change\", not \"not relevant\"."
        },
        "reviewer": {
          "type": "string",
          "description": "Defaults to git config user.name when omitted."
        }
      }
    }
  }
}
